{
  "schema_version": 1,
  "evidence_id": "emulator.bluestacks5.pie64.20260815-090340",
  "capability_id": "emulator.bluestacks5",
  "test_type": "emulator-smoke",
  "result": "passed",
  "captured_at": "2026-08-15T14:04:00Z",
  "commit_sha": "70da5c04fb66b9e23724311a98933e20103df218",
  "redacted": true,
  "environment": {
    "os": "Windows 11 Home",
    "os_version": "10.0.26200",
    "autoit_version": "3.3.16.1",
    "emulator": "BlueStacks5",
    "emulator_version": "5.22.252.1008",
    "instance_index": 0,
    "instance_name": "Pie64",
    "game_version": "18.400.22"
  },
  "binary": {
    "path": "MyBot.run.exe",
    "sha256": "1c0e8f7a9b1df03cd9a36d299c7f9dc6c816c1ebb39597344521ee7bcf51f65c",
    "bytes": 3339776
  },
  "checks": [
    {
      "id": "emulator.detected",
      "result": "passed",
      "details": "The exact BlueStacks 5 Pie64 window and player generation were attached by the reviewed installed backend and remained stable through the bounded Home route."
    },
    {
      "id": "adb.connected",
      "result": "passed",
      "details": "The same authoritative running status reported adb_ready true; reviewed Recovery later closed only two backend-owned helper clients while preserving the original BlueStacks ADB daemon."
    },
    {
      "id": "game.ready",
      "result": "passed",
      "details": "The same running status sample reported game_ready true with run_state and plan_active true; the updated 18.400.22 Home Village then completed the route without a player restart."
    }
  ],
  "reviewer": {
    "name": "My Bot 2.0 runtime review",
    "reviewed_at": "2026-08-15T14:08:09Z"
  },
  "artifact_refs": [
    {
      "kind": "repository",
      "path": "tests/evidence/runtime/artifacts/run-session-home-collectors.pie64.20260815-090340.json",
      "sha256": "3fdf163cfda54c18c499b982c57d3fb52af8423c633cbb0b4684b7102370d2c2",
      "bytes": 5241
    }
  ],
  "notes": "Exact-current BlueStacks 5 Pie64 attachment evidence for one collectors-only no-gem route. It does not promote other emulators, battle recognition, or broader gameplay support."
}
