{
  "schema_version": 1,
  "evidence_id": "orchestration.run-session.pie64.20260815-062306",
  "capability_id": "orchestration.run-session",
  "test_type": "end-to-end",
  "result": "passed",
  "captured_at": "2026-08-15T11:23:06Z",
  "commit_sha": "bc2de4c081ce23461fb4a4e245d9571ffed59f38",
  "redacted": true,
  "environment": {
    "os": "Windows 11 Home",
    "os_version": "10.0.26200",
    "autoit_version": "3.3.16.1",
    "emulator": "BlueStacks5",
    "emulator_version": "5.22.252.1008",
    "instance_index": 0,
    "instance_name": "Pie64",
    "game_version": "18.400.9"
  },
  "binary": {
    "path": "MyBot.run.exe",
    "sha256": "2b78e840314fcb7f208408acd04bb8fceb7826a3f66d8c124fc33b1d4445a9d6",
    "bytes": 3339264
  },
  "checks": [
    {
      "id": "session.started",
      "result": "passed",
      "details": "The bounded collectors run emitted session.preparing sequence 1 followed by session.started sequence 2 when the saved diagnostic plan became active."
    },
    {
      "id": "session.correlated",
      "result": "passed",
      "details": "All seven captured events shared one redacted session reference; the final authoritative idle status cleared the live session."
    },
    {
      "id": "session.completed",
      "result": "passed",
      "details": "Exactly one session.completed sequence 7 followed session.stopping sequence 6 before the engine returned idle."
    }
  ],
  "reviewer": {
    "name": "My Bot 2.0 runtime review",
    "reviewed_at": "2026-08-15T11:25:56Z"
  },
  "artifact_refs": [
    {
      "kind": "repository",
      "path": "tests/evidence/runtime/artifacts/run-session-home-collectors.pie64.20260815-062306.json",
      "sha256": "fb626fb9bf8f9043c91c890746e372bef87d52579d44b7ac85ef9fd74362f1f2",
      "bytes": 3877
    }
  ],
  "notes": "Exact-current diagnostic session-lifecycle evidence from a bounded collectors-only route. It does not claim battle, training, donation, upgrade, account, or premium-currency behavior."
}
