{
  "schema_version": 1,
  "evidence_id": "village.collectors.pie64.recognition.20260814-225345",
  "capability_id": "village.collectors",
  "test_type": "game-surface-recognition",
  "result": "passed",
  "captured_at": "2026-08-14T22:53:56Z",
  "commit_sha": "6b038ea4e5646cf2a5f53f71c0cf28815e207e8e",
  "redacted": true,
  "environment": {
    "os": "Windows 11 Home",
    "os_version": "10.0.26200",
    "autoit_version": "3.3.16.1",
    "emulator": "BlueStacks5",
    "emulator_version": "5.22.252.1008",
    "instance_index": 0,
    "instance_name": "Pie64",
    "game_version": "18.400.9"
  },
  "binary": {
    "path": "MyBot.run.exe",
    "sha256": "704e6596e6c59ee8178b2d3f8e28b052593484d9020147f8046a2c7409c62e77",
    "bytes": 3333120
  },
  "checks": [
    {
      "id": "collectors.recognized",
      "result": "passed",
      "details": "The exact installed route recognized strict gold, elixir, and dark-elixir collector bubbles on a freshly proved Home Village and accepted exactly three bounded inputs."
    },
    {
      "id": "storage-state.confirmed",
      "result": "passed",
      "details": "Gold, elixir, and dark-elixir totals each increased after the accepted inputs while the gem total remained exactly 3,092."
    }
  ],
  "reviewer": {
    "name": "My Bot 2.0 runtime review",
    "reviewed_at": "2026-08-14T23:05:00Z"
  },
  "artifact_refs": [
    {
      "kind": "repository",
      "path": "tests/evidence/runtime/artifacts/home-collectors.pie64.20260814-225345.json",
      "sha256": "e550002b50394ce2dde15bfe28a0b4ba9c9c38fb5907a0be2712c76ec06b0948",
      "bytes": 4172
    }
  ],
  "notes": "Redacted exact-binary live recognition evidence. Raw frames were intentionally not retained because they contained player and clan identifiers, so this record does not satisfy the reusable current-client fixture requirement."
}
