{
  "schema_version": 1,
  "evidence_id": "village.collectors.pie64.recognition.20260815-080233",
  "capability_id": "village.collectors",
  "test_type": "game-surface-recognition",
  "result": "passed",
  "captured_at": "2026-08-15T13:02:33Z",
  "commit_sha": "70da5c04fb66b9e23724311a98933e20103df218",
  "redacted": true,
  "environment": {
    "os": "Windows 11 Home",
    "os_version": "10.0.26200",
    "autoit_version": "3.3.16.1",
    "emulator": "BlueStacks5",
    "emulator_version": "5.22.252.1008",
    "instance_index": 0,
    "instance_name": "Pie64",
    "game_version": "18.400.9"
  },
  "binary": {
    "path": "MyBot.run.exe",
    "sha256": "1c0e8f7a9b1df03cd9a36d299c7f9dc6c816c1ebb39597344521ee7bcf51f65c",
    "bytes": 3339776
  },
  "checks": [
    {
      "id": "collectors.recognized",
      "result": "passed",
      "details": "The exact installed route recognized strict gold, elixir, and dark-elixir collector bubbles on a freshly proved Home Village and accepted exactly three bounded inputs."
    },
    {
      "id": "storage-state.confirmed",
      "result": "passed",
      "details": "Gold increased by 88,550, elixir by 88,494, and dark elixir by 1,005 after the three accepted inputs; the gem total remained exactly 3,092."
    }
  ],
  "reviewer": {
    "name": "My Bot 2.0 runtime review",
    "reviewed_at": "2026-08-15T13:10:24Z"
  },
  "artifact_refs": [
    {
      "kind": "repository",
      "path": "tests/evidence/runtime/artifacts/home-collectors.pie64.20260815-080233.json",
      "sha256": "91bb628bc3875d71715b7270bdb15a32d2c0172e06bd96f01bed20430f0c88ab",
      "bytes": 5688
    }
  ],
  "notes": "Redacted exact-binary recognition evidence. Raw live frames contained player and clan identifiers and remain untracked. No broader collection or gameplay behavior is inferred."
}
