{
  "schema_version": 1,
  "evidence_id": "orchestration.run-session.pie64.20260810",
  "capability_id": "orchestration.run-session",
  "test_type": "end-to-end",
  "result": "passed",
  "captured_at": "2026-08-10T00:42:03Z",
  "commit_sha": "feb2f6dc9581fc3c9bb298a879a90fc31e6d5c5d",
  "redacted": true,
  "environment": {
    "os": "Windows 11",
    "os_version": "10.0.26200",
    "autoit_version": "3.3.16.1",
    "emulator": "BlueStacks5",
    "emulator_version": "5.22.252.1008",
    "instance_index": 0,
    "instance_name": "Pie64",
    "game_version": "18.400.9"
  },
  "binary": {
    "path": "MyBot.run.exe",
    "sha256": "cb2b36f3b5f0711584f438d21cbe0d3aac6f94dba46f52322cda1ac0896557b8",
    "bytes": 3211776
  },
  "checks": [
    {
      "id": "session.started",
      "result": "passed",
      "details": "The controlled run emitted session.started as sequence 1 when the diagnostic plan became active."
    },
    {
      "id": "session.correlated",
      "result": "passed",
      "details": "Started, stopping, and completed events shared one redacted session reference and the final idle status cleared the live session."
    },
    {
      "id": "session.completed",
      "result": "passed",
      "details": "A single session.completed event followed session.stopping before the engine returned to idle."
    }
  ],
  "reviewer": {
    "name": "My Bot 2.0 runtime review",
    "reviewed_at": "2026-08-10T00:43:00Z"
  },
  "artifact_refs": [
    {
      "kind": "repository",
      "path": "tests/evidence/runtime/artifacts/start-ready-stop.pie64.20260810.json",
      "sha256": "45d0834d36c74418e81143cb96beb742d2a8463d23c958e9a7aa133ecc9bbb23",
      "bytes": 3326
    }
  ],
  "notes": "Controlled diagnostic session-lifecycle evidence only. No battle was executed and no gameplay capability is claimed."
}
