{
  "schema_version": 1,
  "evidence_id": "orchestration.run-plan.pie64.20260815-062306",
  "capability_id": "orchestration.run-plan",
  "test_type": "end-to-end",
  "result": "passed",
  "captured_at": "2026-08-15T11:23:06Z",
  "commit_sha": "bc2de4c081ce23461fb4a4e245d9571ffed59f38",
  "redacted": true,
  "environment": {
    "os": "Windows 11 Home",
    "os_version": "10.0.26200",
    "autoit_version": "3.3.16.1",
    "emulator": "BlueStacks5",
    "emulator_version": "5.22.252.1008",
    "instance_index": 0,
    "instance_name": "Pie64",
    "game_version": "18.400.9"
  },
  "binary": {
    "path": "MyBot.run.exe",
    "sha256": "2b78e840314fcb7f208408acd04bb8fceb7826a3f66d8c124fc33b1d4445a9d6",
    "bytes": 3339264
  },
  "checks": [
    {
      "id": "plan.accepted",
      "result": "passed",
      "details": "The complete collectors plan saved with zero validation problems and retained its exact closed-world strategy and runtime binding through completion."
    },
    {
      "id": "run.started",
      "result": "passed",
      "details": "The Start request returned HTTP 202 and the engine reached running with the saved diagnostic plan active."
    },
    {
      "id": "game.ready",
      "result": "passed",
      "details": "A 100 ms sample observed emulator, window, ADB, and game readiness all true while run_state and plan_active were true."
    },
    {
      "id": "run.stopped",
      "result": "passed",
      "details": "The bounded collectors stop condition returned the engine to idle with plan inactive, session cleared, and last_outcome completed."
    }
  ],
  "reviewer": {
    "name": "My Bot 2.0 runtime review",
    "reviewed_at": "2026-08-15T11:25:56Z"
  },
  "artifact_refs": [
    {
      "kind": "repository",
      "path": "tests/evidence/runtime/artifacts/run-session-home-collectors.pie64.20260815-062306.json",
      "sha256": "fb626fb9bf8f9043c91c890746e372bef87d52579d44b7ac85ef9fd74362f1f2",
      "bytes": 3877
    }
  ],
  "notes": "Controlled exact-current diagnostic orchestration evidence only. No battle was executed and no broader gameplay capability is claimed."
}
